{
  "version": 1,
  "markets": [
    {
      "id": "TYO",
      "name": "東京",
      "tz": "Asia/Tokyo",
      "color": "#d46a7e",
      "src": "JPX 01.html／04.html、OSE trading-hours（2026-10-02 查證）",
      "segments": [
        { "kind": "regular", "start": "09:00", "end": "11:30", "days": "Mon-Fri", "label": "前場" },
        { "kind": "regular", "start": "12:30", "end": "15:25", "days": "Mon-Fri", "label": "後場" },
        { "kind": "auction", "start": "15:25", "end": "15:30", "days": "Mon-Fri", "label": "收盤集合競價" },
        { "kind": "night", "start": "17:00", "end": "06:00", "days": "Mon-Fri", "label": "日經225期貨夜盤" }
      ]
    },
    {
      "id": "SEL",
      "name": "首爾",
      "tz": "Asia/Seoul",
      "color": "#a08cf0",
      "src": "KRX 交易指南 PDF、NXT 官網、KRX 夜盤指南（2026-10-02 查證）",
      "segments": [
        { "kind": "pre", "start": "08:00", "end": "08:50", "days": "Mon-Fri", "label": "NXT 盤前" },
        { "kind": "regular", "start": "09:00", "end": "15:20", "days": "Mon-Fri", "label": "正規盤" },
        { "kind": "auction", "start": "15:20", "end": "15:30", "days": "Mon-Fri", "label": "收盤集合競價" },
        { "kind": "post", "start": "15:40", "end": "20:00", "days": "Mon-Fri", "label": "NXT 盤後" },
        { "kind": "night", "start": "18:00", "end": "06:00", "days": "Mon-Fri", "label": "KOSPI200 期貨夜盤" }
      ]
    },
    {
      "id": "TPE",
      "name": "台北",
      "tz": "Asia/Taipei",
      "color": "#3fb6a8",
      "src": "TWSE trading.html、TAIFEX tX／aHIntroduction（2026-10-02 查證）",
      "segments": [
        { "kind": "regular", "start": "09:00", "end": "13:25", "days": "Mon-Fri", "label": "盤中" },
        { "kind": "auction", "start": "13:25", "end": "13:30", "days": "Mon-Fri", "label": "收盤集合競價" },
        { "kind": "post", "start": "14:00", "end": "14:30", "days": "Mon-Fri", "label": "盤後定價" },
        { "kind": "night", "start": "15:00", "end": "05:00", "days": "Mon-Fri", "skip": "nth:3:3", "label": "台指期夜盤（結算日無）" }
      ]
    },
    {
      "id": "HKG",
      "name": "香港",
      "tz": "Asia/Hong_Kong",
      "color": "#e0915a",
      "src": "HKEX Trading Hours 現貨／衍生品（2026-10-02 查證）",
      "segments": [
        { "kind": "auction", "start": "09:00", "end": "09:30", "days": "Mon-Fri", "label": "開市前時段" },
        { "kind": "regular", "start": "09:30", "end": "16:00", "days": "Mon-Fri", "label": "早市＋延長早市＋午市" },
        { "kind": "auction", "start": "16:00", "end": "16:10", "days": "Mon-Fri", "label": "收市競價" },
        { "kind": "night", "start": "17:00", "end": "03:00", "days": "Mon-Fri", "label": "恆指期貨收市後" }
      ]
    },
    {
      "id": "LON",
      "name": "倫敦",
      "tz": "Europe/London",
      "color": "#7fb2e5",
      "src": "LSE Business Parameters v10.0 Trading Cycles（SETS-L1）、MIT201 15.9 §4.5、ice.com FTSE 100 Index Future 規格頁（2026-10-02 瀏覽器重驗）",
      "segments": [
        { "kind": "night", "start": "01:00", "end": "07:50", "days": "Mon-Fri", "label": "FTSE 100 期貨（現貨前）" },
        { "kind": "auction", "start": "07:50", "end": "08:00", "days": "Mon-Fri", "label": "開盤競價" },
        { "kind": "regular", "start": "08:00", "end": "16:30", "days": "Mon-Fri", "label": "連續交易" },
        { "kind": "auction", "start": "16:30", "end": "16:35", "days": "Mon-Fri", "label": "收盤競價" },
        { "kind": "post", "start": "16:35", "end": "16:40", "days": "Mon-Fri", "label": "收盤價交易（CPX）" },
        { "kind": "night", "start": "16:35", "end": "21:00", "days": "Mon-Fri", "label": "FTSE 100 期貨（現貨後）" }
      ]
    },
    {
      "id": "NYC",
      "name": "紐約",
      "tz": "America/New_York",
      "color": "#d8dff0",
      "src": "NYSE hours-calendars、Nasdaq、cmegroup.com E-mini S&P 500 Contract Specs（ES 2026-10-02 瀏覽器重驗）",
      "segments": [
        { "kind": "pre", "start": "04:00", "end": "09:30", "days": "Mon-Fri", "label": "盤前" },
        { "kind": "regular", "start": "09:30", "end": "16:00", "days": "Mon-Fri", "label": "正規交易" },
        { "kind": "post", "start": "16:00", "end": "20:00", "days": "Mon-Fri", "label": "盤後" },
        { "kind": "pre", "start": "21:00", "end": "04:00", "days": "Sun-Thu", "effective": "2026-12-06", "label": "Overnight（預定 2026-12-06 起）" },
        { "kind": "night", "start": "16:00", "end": "17:00", "days": "Mon-Fri", "label": "E-mini S&P 500 期貨（現貨休市時段）" },
        { "kind": "night", "start": "18:00", "end": "09:30", "days": "Sun-Thu", "label": "E-mini S&P 500 期貨（現貨休市時段）" }
      ]
    }
  ],
  "holidays": {
    "TPE": {
      "2026": {
        "through": "2026-12-31",
        "days": [
          { "date": "2026-01-01", "name": "開國紀念日", "src": "twse-2026" },
          { "date": "2026-02-12", "name": "農曆春節前休市", "src": "twse-2026" },
          { "date": "2026-02-13", "name": "農曆春節前休市", "src": "twse-2026" },
          { "date": "2026-02-16", "name": "農曆春節", "src": "twse-2026" },
          { "date": "2026-02-17", "name": "農曆春節", "src": "twse-2026" },
          { "date": "2026-02-18", "name": "農曆春節", "src": "twse-2026" },
          { "date": "2026-02-19", "name": "農曆春節", "src": "twse-2026" },
          { "date": "2026-02-20", "name": "農曆春節（補假）", "src": "twse-2026" },
          { "date": "2026-02-27", "name": "和平紀念日（補假）", "src": "twse-2026" },
          { "date": "2026-04-03", "name": "兒童節（補假）", "src": "twse-2026" },
          { "date": "2026-04-06", "name": "民族掃墓節（補假）", "src": "twse-2026" },
          { "date": "2026-05-01", "name": "勞動節", "src": "twse-2026" },
          { "date": "2026-06-19", "name": "端午節", "src": "twse-2026" },
          { "date": "2026-09-25", "name": "中秋節", "src": "twse-2026" },
          { "date": "2026-09-28", "name": "教師節", "src": "twse-2026" },
          { "date": "2026-10-09", "name": "國慶日（補假）", "src": "twse-2026" },
          { "date": "2026-10-26", "name": "臺灣光復節（補假）", "src": "twse-2026" },
          { "date": "2026-12-25", "name": "行憲紀念日", "src": "twse-2026" }
        ]
      }
    },
    "TYO": {
      "2026": {
        "through": "2026-12-31",
        "days": [
          { "date": "2026-01-01", "name": "元旦", "src": "jpx" },
          { "date": "2026-01-02", "name": "年始休市", "src": "jpx" },
          { "date": "2026-01-12", "name": "成人之日", "src": "jpx" },
          { "date": "2026-02-11", "name": "建國紀念日", "src": "jpx" },
          { "date": "2026-02-23", "name": "天皇誕辰", "src": "jpx" },
          { "date": "2026-03-20", "name": "春分", "src": "jpx" },
          { "date": "2026-04-29", "name": "昭和之日", "src": "jpx" },
          { "date": "2026-05-04", "name": "綠之日", "src": "jpx" },
          { "date": "2026-05-05", "name": "兒童節", "src": "jpx" },
          { "date": "2026-05-06", "name": "憲法紀念日（補假）", "src": "jpx" },
          { "date": "2026-07-20", "name": "海之日", "src": "jpx" },
          { "date": "2026-08-11", "name": "山之日", "src": "jpx" },
          { "date": "2026-09-21", "name": "敬老之日", "src": "jpx" },
          { "date": "2026-09-22", "name": "國民休日", "src": "jpx" },
          { "date": "2026-09-23", "name": "秋分", "src": "jpx" },
          { "date": "2026-10-12", "name": "體育之日", "src": "jpx" },
          { "date": "2026-11-03", "name": "文化之日", "src": "jpx" },
          { "date": "2026-11-23", "name": "勤勞感謝日", "src": "jpx" },
          { "date": "2026-12-31", "name": "年末休市", "src": "jpx" }
        ]
      },
      "2027": {
        "through": "2027-12-31",
        "days": [
          { "date": "2027-01-01", "name": "元旦", "src": "jpx" },
          { "date": "2027-01-11", "name": "成人之日", "src": "jpx" },
          { "date": "2027-02-11", "name": "建國紀念日", "src": "jpx" },
          { "date": "2027-02-23", "name": "天皇誕辰", "src": "jpx" },
          { "date": "2027-03-22", "name": "春分（補假）", "src": "jpx" },
          { "date": "2027-04-29", "name": "昭和之日", "src": "jpx" },
          { "date": "2027-05-03", "name": "憲法紀念日", "src": "jpx" },
          { "date": "2027-05-04", "name": "綠之日", "src": "jpx" },
          { "date": "2027-05-05", "name": "兒童節", "src": "jpx" },
          { "date": "2027-07-19", "name": "海之日", "src": "jpx" },
          { "date": "2027-08-11", "name": "山之日", "src": "jpx" },
          { "date": "2027-09-20", "name": "敬老之日", "src": "jpx" },
          { "date": "2027-09-23", "name": "秋分", "src": "jpx" },
          { "date": "2027-10-11", "name": "體育之日", "src": "jpx" },
          { "date": "2027-11-03", "name": "文化之日", "src": "jpx" },
          { "date": "2027-11-23", "name": "勤勞感謝日", "src": "jpx" },
          { "date": "2027-12-31", "name": "年末休市", "src": "jpx" }
        ]
      }
    },
    "SEL": {
      "2026": {
        "through": "2026-12-31",
        "days": [
          { "date": "2026-01-01", "name": "元旦", "src": "krx-2026" },
          { "date": "2026-02-16", "name": "農曆春節", "src": "krx-2026" },
          { "date": "2026-02-17", "name": "農曆春節", "src": "krx-2026" },
          { "date": "2026-02-18", "name": "農曆春節", "src": "krx-2026" },
          { "date": "2026-03-02", "name": "三一節（補假）", "src": "krx-2026" },
          { "date": "2026-05-01", "name": "勞動節", "src": "krx-2026" },
          { "date": "2026-05-05", "name": "兒童節", "src": "krx-2026" },
          { "date": "2026-05-25", "name": "佛誕日（補假）", "src": "krx-2026" },
          { "date": "2026-06-03", "name": "臨時公休日", "src": "krx-2026" },
          { "date": "2026-07-17", "name": "制憲節", "src": "krx-2026" },
          { "date": "2026-08-17", "name": "光復節（補假）", "src": "krx-2026" },
          { "date": "2026-09-24", "name": "中秋節", "src": "krx-2026" },
          { "date": "2026-09-25", "name": "中秋節", "src": "krx-2026" },
          { "date": "2026-10-05", "name": "開天節（補假）", "src": "krx-2026" },
          { "date": "2026-10-09", "name": "韓文日", "src": "krx-2026" },
          { "date": "2026-12-25", "name": "聖誕節", "src": "krx-2026" },
          { "date": "2026-12-31", "name": "年終休市", "src": "krx-2026" }
        ]
      },
      "2027": {
        "through": "2027-12-31",
        "verified": false,
        "days": [
          { "date": "2027-01-01", "name": "元旦", "src": "krx-2027" },
          { "date": "2027-02-08", "name": "農曆春節", "src": "krx-2027" },